### ISSUE TITLE
Can't connect to Calibre

### ISSUE THREAD

**Issue by Nippius** [koreader/koreader#14723]
### Device

Kobo

### KOReader version

2025.10

### Model and firmware version

Kobo_spaBW

### Issue description

Since I updated to version 2025.10 that connecting to Calibre via wireless connection stopped working. No matter what I do, I always get the message "Couldn't discover a calibre instance on the local network".

I really can't tell why.

Here's a list of things I've checked:
- Thei are one the same network
- Calibre has the correct firewall permissions
- I've tried with the firewall disabled
- There are no crash logs as far as I can tell (the file isn't created when verbose logging in active.
- Directly connect to Calibre via IP/Port combination
- Can enable SSH server but can't connect to it from my Desktop
- Connecting to the internet seems to work. Opening the terminal and pingging 8.8.8.8 works as expected.

One thing I did notice was that when connecting to Wi-Fi, It appeared that an error briefly came up. Searching these issues, I found #14716 . Could this be related?

### Steps to reproduce

1. Go to 'Tools'
2. Click on 'Calibre'
3. Scroll down to 'Connect'
4. Click 'Connect'

**Comment by benoit-pierre** [comment]
> There are no crash logs as far as I can tell (the file isn't created when verbose logging in active.

That does not make sense, there should be a `crash.log` created anyway.

Additionally, what's the output if you start calibre from a terminal and try to connect?

**Comment by Nippius** [comment]
Nevermind, found it: [crash.log](https://github.com/user-attachments/files/24176659/crash.log)

> Additionally, what's the output if you start calibre from a terminal and try to connect?

I'm on Windows and Calibre is not showing any logs on the terminal. Having said that, I can't test that now because, believe or not, it's working now.... I'll keep trying and if it fails again, I'll post the logs if any

edit: Forgot to say but that crash.log includes several months of data so it includes the issue I was having yesterday, as well as todays attempt when it worked. Hope that helps

**Comment by jackpenny101** [comment]
Same for me on my Kobo.

**Comment by bpowell2008** [comment]
Same thing just started happening here ... wireless connection to Calibre fails. Using Koreader ... I've found these entries in the crash-log:

```
`12/18/25-20:36:00 INFO  calibre: connecting to 192.168.2.15:9090 (specified) 

12/18/25-20:36:01 INFO  Inhibiting user input 

12/18/25-20:36:01 INFO  calibre info loaded from disk in 27.000 milliseconds: 88 books. 0 pruned 

12/18/25-20:36:01 INFO  Restoring user input handling 

12/18/25-20:36:06 WARN  calibre: connection failed, connection refused 

12/18/25-20:36:06 INFO  Inhibiting user input 

12/18/25-20:36:06 INFO  calibre: disconnecting 

12/18/25-20:36:07 INFO  Restoring user input handling 

12/18/25-20:37:46 INFO  calibre: connecting to 192.168.2.15:9090 (specified) 

12/18/25-20:37:47 INFO  Inhibiting user input 

12/18/25-20:37:47 INFO  calibre info loaded from disk in 20.000 milliseconds: 88 books. 0 pruned 

12/18/25-20:37:48 INFO  Restoring user input handling 

12/18/25-20:37:52 WARN  calibre: connection failed, handshake timeout
 
12/18/25-20:37:52 INFO  Inhibiting user input 

12/18/25-20:37:52 INFO  calibre: disconnecting 

12/18/25-20:37:53 INFO  Restoring user input handling `
```

I can Telnet to the calibre server on port 9090 and get the black screen (indicating *something* is listening there)

KOreader can still use the OPDS connection to get to Calibre ... but that's not as nice as having it wirelessly connect to the server like it used to.

**Comment by jwestbury** [comment]
Also on 2025.10, using kindlepw2, and seeing handshake failures. See tcpdump output:

```
17:00:57.960875 IP 192.168.50.23.45616 > 192.168.50.65.websm: Flags [S], seq 621894338, win 14600, options [mss 1460,sackOK,TS val 288567 ecr 0,nop,wscale 5], length 0
17:00:57.961363 IP 192.168.50.65.websm > 192.168.50.23.45616: Flags [S.], seq 1631359061, ack 621894339, win 65535, options [mss 1460,nop,wscale 6,nop,nop,TS val 2096769347 ecr 288567,sackOK,eol], length 0
17:00:58.961576 IP 192.168.50.65.websm > 192.168.50.23.45616: Flags [S.], seq 1631359061, ack 621894339, win 65535, options [mss 1460,nop,wscale 6,nop,nop,TS val 2096770348 ecr 288567,sackOK,eol], length 0
17:01:00.962764 IP 192.168.50.65.websm > 192.168.50.23.45616: Flags [S.], seq 1631359061, ack 621894339, win 65535, options [mss 1460,nop,wscale 6,nop,nop,TS val 2096772349 ecr 288567,sackOK,eol], length 0
17:01:00.970738 IP 192.168.50.23.45616 > 192.168.50.65.websm: Flags [S], seq 621894338, win 14600, options [mss 1460,sackOK,TS val 288868 ecr 0,nop,wscale 5], length 0
17:01:00.970892 IP 192.168.50.65.websm > 192.168.50.23.45616: Flags [S.], seq 1631359061, ack 621894339, win 65535, options [mss 1460,nop,wscale 6,nop,nop,TS val 2096772357 ecr 288868,sackOK,eol], length 0
17:01:02.977128 IP 192.168.50.23.45617 > 192.168.50.65.websm: Flags [S], seq 3535014034, win 14600, options [mss 1460,sackOK,TS val 289068 ecr 0,nop,wscale 5], length 0
17:01:04.963364 IP 192.168.50.65.websm > 192.168.50.23.45616: Flags [S.], seq 1631359061, ack 621894339, win 65535, options [mss 1460,nop,wscale 6,nop,nop,TS val 2096776350 ecr 288868,sackOK,eol], length 0
17:01:06.051825 IP 192.168.50.23.45617 > 192.168.50.65.websm: Flags [S], seq 3535014034, win 14600, options [mss 1460,sackOK,TS val 289369 ecr 0,nop,wscale 5], length 0
17:01:06.973784 IP 192.168.50.23.45616 > 192.168.50.65.websm: Flags [S], seq 621894338, win 14600, options [mss 1460,sackOK,TS val 289470 ecr 0,nop,wscale 5], length 0
17:01:06.973923 IP 192.168.50.65.websm > 192.168.50.23.45616: Flags [S.], seq 1631359061, ack 621894339, win 65535, options [mss 1460,nop,wscale 6,nop,nop,TS val 2096778360 ecr 289470,sackOK,eol], length 0
17:01:12.965316 IP 192.168.50.65.websm > 192.168.50.23.45616: Flags [S.], seq 1631359061, ack 621894339, win 65535, options [mss 1460,nop,wscale 6,nop,nop,TS val 2096784351 ecr 289470,sackOK,eol], length 0
17:01:28.966063 IP 192.168.50.65.websm > 192.168.50.23.45616: Flags [S.], seq 1631359061, ack 621894339, win 65535, options [mss 1460,nop,wscale 6,nop,nop,TS val 2096800352 ecr 289470,sackOK,eol], length 0
17:02:00.967128 IP 192.168.50.65.websm > 192.168.50.23.45616: Flags [S.], seq 1631359061, ack 621894339, win 65535, options [mss 1460,nop,wscale 6,nop,nop,TS val 2096832353 ecr 289470,sackOK,eol], length 0
17:02:12.962483 IP 192.168.50.65.websm > 192.168.50.23.45616: Flags [R.], seq 1, ack 1, win 65535, length 0
```

Looks like the "handshake" that's failing is the TCP handshake. Calibre is responding with SYN/ACK, but koreader isn't sending back the final ACK. From other devices on the network, bidirectional traffic is fine, and I can see a complete packet flow, so this does seem scoped to koreader.

koreader crash logs show that it's loading some info from disk, then failing:

```
02/15/26-17:00:57 INFO  calibre: connecting to 192.168.50.65:9090 (specified) 
02/15/26-17:00:57 INFO  Inhibiting user input 
02/15/26-17:00:57 INFO  calibre info loaded from disk in 3.000 milliseconds: 0 books. 0 pruned 
02/15/26-17:00:58 INFO  Restoring user input handling 
02/15/26-17:01:07 WARN  calibre: connection failed, timeout 
```

**Comment by jwestbury** [comment]
^ I've dug into this a bit, and at least in my case, the tcpdump findings are a bit misleading - conntrack on the Kindle shows that we're actually establishing a connection just fine, and after adding some debug output to the Lua scripts, I've determined that the handshake failing isn't TCP, but the connection to Calibre, which is reporting itself as busy:

```
02/15/26-20:39:25 INFO  StreamMessageQueue: first bytes: 38[18, {"otherDevice": "Folder Device"}] 
```

Apparently I had a folder connection I'd opened at some point in the past, which was causing this.

For my issue, at least, I think surfacing surfacing the relevant opcode would be a big improvement.
