### ISSUE TITLE
Wireless Calibre Connection Timeout Error, cannot find a fix

### ISSUE THREAD

**Issue by wmcelheney** [koreader/koreader#13406]
* KOReader version: 2024.11-99
* Device: Kindle Paperwhite 11th Gen, running firmware Kindle 5.17.1.0.3

#### Issue
When trying to connect wirelessly through KOReader to Calibre, using either the Content Server or the Wireless Device Connection on Calibre, even after manually inputting both IP Adress and port number, KoReader fails to connect, giving an error message of "Cannot connect to calibre server at ###.###.##.###:#### (timeout)". 

#### Steps to reproduce
Opening KOReader
Select Calibre in the top down menu, under the tools tab
Select Connect (after having manually inputted the correct IP and Port)
error message pops up. finds the IP address but times out

##### `crash.log` (if applicable)
no crash log that I would be aware of.

Sorry I have not formatted this correctly. I am new to KOReader / this forum and have seen several other people with the same problem on reddit that also did not have a solution. So, I wanted to take the time to bring it to KoReader's attention.

**Comment by pazos** [comment]
> . I am new to KOReader / this forum and have seen several other people with the same problem on reddit that also did not have a solution.

**Comment by shuvashish76** [comment]
As mentioned in the [wiki](https://github.com/koreader/koreader/wiki/calibre#24-ports-firewall), don't forget to whitelist those ports if you're using Firewall.

**Comment by wmcelheney** [comment]
> As mentioned in the [wiki](https://github.com/koreader/koreader/wiki/calibre#24-ports-firewall), don't forget to whitelist those ports if you're using Firewall.

i've checked my macbook settings and I currently have no firewall active

**Comment by wmcelheney** [comment]
> > . I am new to KOReader / this forum and have seen several other people with the same problem on reddit that also did not have a solution.
> 
> Asumming all of them are kindle users. The best recommendation for them is to install KO on their android phone or linux desktop and try to reproduce there. If they cannot reproduce it is something with kindles + wifi/network/firewall. If they can reproduce it is a matter of basic local area network configuration.

Unfortunately I am solely on Apple ecosystem, so I do not have a way to use an android phone or linux desktop

**Comment by pazos** [comment]
> would it be able to mimic trying to wirelessly connect when both applications wouild be runnign from the same computer?

You should be able to test if it works and assume something is very bad with your calibre configuration (ie: are those service **active**?) in case it doesn't.

**Comment by wmcelheney** [comment]
i have downloaded it onto my mac and whenever I tell it connect to calibre, it then immediately asks to select a folder. I've never successfully used the function so I am not sure if that is what happens when it works or not. However, whenever I select any folder, KOReader immediately crashes.

**Comment by pazos** [comment]
> i have downloaded KoReader successfully onto my mac and whenever I tell it connect to calibre, it then immediately asks to select a folder. I've never successfully used the function so I am not sure if that is what happens when it works or not. However, whenever I select any folder, KOReader immediately crashes.

That's unfortunate and quite likely an unrelated bug that might be caused by many, many bad actors (running the app bundle from download folder, skipping giving permissions on the specific folders when prompted by your OS....)

Since your main purpose wasn't run KO on a mac we can settle this here. 

>  have seen several other people with the same problem on reddit that also did not have a solution

Just scrapped reddit a little bit and saw nothing like that. In fact `calibre wireless` is a big plus among recent jailbroken/kindle users. It is also suggested as they way to transfer books within KOReader, since USB mass storage isn't available and require you to switch back to Kindle UI.

I'm starting to think it is a `PEBKAC`. I'm going to close this ticket. If some of the people that you saw having that issue could provide new info on the topic I'll open it again. Please share the link to the ticket with them.

Please consider double checking the proper instructions at https://github.com/koreader/koreader/wiki/calibre#2-wireless-client and feel free to ask if something isn't clear. Improvements can be made on the documentation.

**Comment by wmcelheney** [comment]
i have done everything to the letter and am getting an error. The reason I say others have expressed it happening to them is because I posted this problem on reddit and had several people express the same problem. https://www.reddit.com/r/koreader/comments/1j0ej8y/cannot_connect_to_calibre_server_at_error_cant/

So i just want to seek some understanding. What is a PEBKAC? and is there any help that anyone can give me to figure out why this is happening? I would like to be able to use this feature and I still do not have any idea how to make it work.

**Comment by sunnyvilles** [comment]
Having the same problem in kindle scribe 2022 (kindle - 5.17.3, Koreader - 2025-08-0000008 ).

"Cannot connect to calibre server at ###.###.##.###:#### (handshake timeout)".

I am able to access it via the browser btw so seem like the server is fine.

**Comment by DaveFace** [comment]
I'm getting the same error - I'm running Calibre on an Unraid server via Docker and I've ensured every UDP port is passed through but it will not connect at all, even if I manually specify the server address (i.e. 192.168.1.xxx)

- 8080:TCP
- 8081:TCP
- 8181:TCP
- 9090:TCP
- 39001:UDP
- 44044:UDP
- 48123:UDP
- 54982:UDP
- 59678:UDP

This is using Calibre 8.11.1 and I'm trying to sync to a Kindle (5.18.5,  KOReader v2025.08). I can access the webserver via the Kindle web browser fine. I'd use ODPS instead but I can't see a way to set up a generic connection for that, so I'm stuck trying to get Calibre to work. I think it would be really useful to have more info on what specifically is failing with the connection.

**Comment by twistios** [comment]
I have this problem on an Android Phone. I am able to open the calibre server website via the webbrowser on the phone.
https://github.com/koreader/koreader/issues/13406

**Comment by schoubi** [comment]
Edit: PEBKAC... windows silently put my ethernet connexion as "Public" and so activate firewall for all incoming connexions....

~~I can confirm the issue aswell~~
~~I used to transfer books using wireless mode but it doesn't work anymore.~~
~~I didn't update KoReader, so my guess is on the Calibre side....~~

~~I updated both before running this tests  (KOReader 2025.10 / Calibre 8.16.1)~~

~~On the computer running calibre in debug mode we can see it doesn't work anymore :~~

~~- the "smartdevice driver" (wireless connector from calibre) is correctly running on port 8000 :~~

~~netstat~~

~~- the KORreader can't connect (time-out)~~
~~- a TCP Dump on the PC running calibre show the packets correctly coming from the KOReader (192.168.1.93) on port 8000 of the PC, but no answer....~~

~~something's off on calibre side...~~

**Comment by maxsmooth** [comment]
Same issue here, no firewall on my pc or on wifi router.
Here is a tcpdump on port 9191 (nxtvision is android tablet with koreader, sheldon is pc with calibre)

sudo tcpdump port 9191                                                                                                                                                                             ✔ 
tcpdump: verbose output suppressed, use -v[v]... for full protocol decode
listening on wlp2s0, link-type EN10MB (Ethernet), snapshot length 262144 bytes
22:15:32.793186 IP nxtvision.37334 > sheldon.sun-as-jpda: Flags [S], seq 2992715623, win 65535, options [mss 1460,sackOK,TS val 4235626799 ecr 0,nop,wscale 8], length 0
22:15:32.793219 IP sheldon.sun-as-jpda > nxtvision.37334: Flags [S.], seq 4292230623, ack 2992715624, win 65160, options [mss 1460,sackOK,TS val 1883362323 ecr 4235626799,nop,wscale 7], length 0
22:15:33.794391 IP sheldon.sun-as-jpda > nxtvision.37334: Flags [S.], seq 4292230623, ack 2992715624, win 65160, options [mss 1460,sackOK,TS val 1883363325 ecr 4235626799,nop,wscale 7], length 0
22:15:35.901183 IP sheldon.sun-as-jpda > nxtvision.37334: Flags [S.], seq 4292230623, ack 2992715624, win 65160, options [mss 1460,sackOK,TS val 1883365431 ecr 4235626799,nop,wscale 7], length 0
22:15:37.798084 IP nxtvision.37344 > sheldon.sun-as-jpda: Flags [S], seq 2094371417, win 65535, options [mss 1460,sackOK,TS val 4235631803 ecr 0,nop,wscale 8], length 0
22:15:37.798116 IP sheldon.sun-as-jpda > nxtvision.37344: Flags [S.], seq 2486000535, ack 2094371418, win 65160, options [mss 1460,sackOK,TS val 1883367328 ecr 4235631803,nop,wscale 7], length 0
22:15:37.804426 IP nxtvision.37344 > sheldon.sun-as-jpda: Flags [F.], seq 1, ack 1, win 256, options [nop,nop,TS val 4235631815 ecr 1883367328], length 0
22:15:37.807806 IP sheldon.sun-as-jpda > nxtvision.37344: Flags [.], ack 2, win 510, options [nop,nop,TS val 1883367338 ecr 4235631815], length 0
22:15:37.969566 IP nxtvision.37334 > sheldon.sun-as-jpda: Flags [F.], seq 1, ack 1, win 256, options [nop,nop,TS val 4235631977 ecr 1883362323], length 0
22:15:37.971142 IP sheldon.sun-as-jpda > nxtvision.37334: Flags [.], ack 2, win 510, options [nop,nop,TS val 1883367501 ecr 4235631977], length 0
22:15:39.364783 IP sheldon.sun-as-jpda > nxtvision.37344: Flags [P.], seq 1:888, ack 2, win 510, options [nop,nop,TS val 1883368895 ecr 4235631815], length 887
22:15:39.364979 IP sheldon.sun-as-jpda > nxtvision.37344: Flags [F.], seq 888, ack 2, win 510, options [nop,nop,TS val 1883368895 ecr 4235631815], length 0
22:15:39.384481 IP sheldon.sun-as-jpda > nxtvision.37344: Flags [F.], seq 888, ack 2, win 510, options [nop,nop,TS val 1883368915 ecr 4235631815], length 0
22:15:39.413691 IP nxtvision.37344 > sheldon.sun-as-jpda: Flags [R], seq 2094371419, win 0, length 0
22:15:39.413691 IP nxtvision.37344 > sheldon.sun-as-jpda: Flags [R], seq 2094371419, win 0, length 0
22:15:39.413691 IP nxtvision.37344 > sheldon.sun-as-jpda: Flags [R], seq 2094371419, win 0, length 0
22:15:41.366899 IP sheldon.sun-as-jpda > nxtvision.37334: Flags [P.], seq 1:888, ack 2, win 510, options [nop,nop,TS val 1883370897 ecr 4235631977], length 887
22:15:41.367097 IP sheldon.sun-as-jpda > nxtvision.37334: Flags [F.], seq 888, ack 2, win 510, options [nop,nop,TS val 1883370897 ecr 4235631977], length 0
22:15:41.565650 IP nxtvision.37334 > sheldon.sun-as-jpda: Flags [R], seq 2992715625, win 0, length 0
22:15:41.565654 IP nxtvision.37334 > sheldon.sun-as-jpda: Flags [R], seq 2992715625, win 0, length 0

<img width="1765" height="435" alt="Image" src="https://github.com/user-attachments/assets/0574c949-5f19-4299-b1b3-79e207023ff3" />

**Comment by Eli-I-Mcdonald** [comment]
I likewise have a similar problem with koreader detecting the server than displaying the issue (Handshake timout) and the connection failing

**Comment by claman** [comment]
I'm also encountering this issue. It's confirmed that the udp port for discovery is working (since KOReader can automatically detect the server on the network), but the connection over the tcp port is failing. I fairly confident that it's an issue with my firewall config, despite the requisite tcp port being opened, since the wireless connection works as expected with the firewall ruleset completely flushed.

Running KOReader 2025.10, Kindle 5.16.2.1.1, Arch Linux, and calibre 9.4.0

**Comment by benoit-pierre** [comment]
Please create a dedicated issue, and provide more information: just commenting "me too" without at least the versions of calibre & KOReader used, and the environment they are running on (device, firmware / operating system) is pretty much useless.

First things first:
- update to the latest nightly
- run calibre from a terminal using something like "PYTHONUNBUFFERED=1 calibre-debug --gui 2>&1 | ts %R:%.S | tee calibre.log"
- provide `calibre.log` and KOReader's `crash.log` with debugging messages activated
- does the connection work when using the AppImage on the same machine?

One reason the connection could fail, despite the network configuration being fine, is if you hit the maximum number of failed connection attempts (which is 5, see https://github.com/koreader/koreader/issues/12456#issuecomment-2844567070).

**Comment by claman** [comment]
@benoit-pierre apologies, will test with those parameters, etc. and report back with a new issue if the problem persists

**Comment by jack-champagne** [comment]
I am running calibre 8.7 on Arch Linux and using KOReader 2026.03 "Snowflake" on my kindle paperwhite 11th generation. I ran into this issue but **got it working after I realized** that I had neglected to click "_Start wireless device connection_" in calibre.

<img width="968" height="343" alt="Image" src="https://github.com/user-attachments/assets/fb48f706-8cdb-4d81-9c2f-375e95b0b0e0" />
